{
  "schema": "elevenviews.bridge.receipt.v1",
  "receiptId": "2b3c4d5e-6f7a-8b9c-0d1e-2f3a4b5c6d7e",
  "requestId": "7f4e2a91-0c3b-4d5e-8a1f-2b9c0d3e4f5a",
  "capability": "share.attachToDeskIssue",
  "outcome": "success",
  "artifacts": [
    {
      "kind": "file",
      "path": "/Users/simeon/Library/Application Support/io.elevenviews.tools/captures/region-20260823-162501.png",
      "mimeType": "image/png",
      "bytes": 148213,
      "sha256": "e3b0c44298fc1c149afbf4c8996fb92427ae41e4649b934ca495991b7852b855",
      "description": "Attached to Desk issue 6125b020-f7d3-468b-bf6b-13c5c9844939 as 61a34f2f-8ad9-4c2f-958f-389eafbd739e. Read-back verified."
    }
  ],
  "permissionsUsed": [],
  "approval": { "token": "appr_share_9c0b3d55", "grantedBy": "local-user-action" },
  "error": null,
  "startedAt": "2026-08-23T16:30:01Z",
  "completedAt": "2026-08-23T16:30:04Z",
  "host": {
    "app": "Eleven Views Tools",
    "version": "1.0.0",
    "registryVersion": 1
  }
}
