{
  "schema": "elevenviews.bridge.receipt.v1",
  "receiptId": "c2d3e4f5-a6b7-8901-cdef-123456789012",
  "requestId": "a1b2c3d4-e5f6-7890-abcd-ef1234567890",
  "capability": "share.attachCaptureToDesk",
  "outcome": "success",
  "artifacts": [
    {
      "kind": "json",
      "mimeType": "application/json",
      "sha256": "1fe68c37f30f72a35ec894baa495598bc2b32574ff900ce44d7118d1c7ecb0c2",
      "bytes": 69,
      "inline": {
        "attachmentId": "1e086209-9dd7-4275-bdd2-cc7a95fbe889",
        "issueId": "455af507-4589-45e0-8e47-495709d876f3",
        "sha256": "1fe68c37f30f72a35ec894baa495598bc2b32574ff900ce44d7118d1c7ecb0c2",
        "byteSize": 69,
        "contentPath": "/api/attachments/1e086209-9dd7-4275-bdd2-cc7a95fbe889/content"
      },
      "description": "Desk attachment with read-back sha256 verification."
    }
  ],
  "permissionsUsed": [],
  "approval": {
    "token": "local-user-approval-token",
    "grantedBy": "local-user-action"
  },
  "error": null,
  "startedAt": "2026-08-23T19:00:00Z",
  "completedAt": "2026-08-23T19:00:01Z",
  "host": {
    "app": "Eleven Views Tools",
    "version": "3.3.3-beta.2",
    "registryVersion": 1
  }
}
