{
  "schema": "elevenviews.bridge.receipt.v1",
  "receiptId": "1a2b3c4d-5e6f-4a7b-8c9d-0e1f2a3b4c5d",
  "requestId": "9c0b3d55-2e77-4b90-a1f2-6d4e8b2c1a09",
  "capability": "screen.captureRegion",
  "outcome": "success",
  "artifacts": [
    {
      "kind": "image",
      "path": "/Users/simeon/Library/Application Support/Eleven Views Tools/captures/region-20260823-162501.png",
      "mimeType": "image/png",
      "bytes": 148213,
      "sha256": "e3b0c44298fc1c149afbf4c8996fb92427ae41e4649b934ca495991b7852b855",
      "description": "Captured region. Stays local until an explicit share capability moves it."
    }
  ],
  "permissionsUsed": ["screenRecording"],
  "approval": { "token": "appr_2f8c1d7a9e", "grantedBy": "local-user-action" },
  "error": null,
  "startedAt": "2026-08-23T16:25:01Z",
  "completedAt": "2026-08-23T16:25:03Z",
  "host": {
    "app": "Eleven Views Tools",
    "version": "1.0.0",
    "registryVersion": 1
  }
}
